{
  "id": "media-type/application-vnd-etsi-iptvdiscovery-xml",
  "family": "media-type",
  "slug": "application-vnd-etsi-iptvdiscovery-xml",
  "title": "application/vnd.etsi.iptvdiscovery+xml",
  "summary": "Media type \"application/vnd.etsi.iptvdiscovery+xml\".",
  "kind": "media-type",
  "status": "standard",
  "verification": "verified",
  "tier": "A",
  "source_url": "https://www.iana.org/assignments/media-types/application.csv",
  "source_version": "IANA registry, Last-Modified: Wed, 20 May 2026 17:41:23 GMT",
  "retrieved_date": "2026-05-29",
  "ext_type": "iana-registry-row@1",
  "ext": {
    "value": "application/vnd.etsi.iptvdiscovery+xml",
    "reference_rfcs": [],
    "raw_columns": {
      "Name": "vnd.etsi.iptvdiscovery+xml",
      "Template": "application/vnd.etsi.iptvdiscovery+xml",
      "Reference": "[Shicheng_Hu]"
    }
  },
  "updated": "2026-05-29",
  "aliases": [
    "application/vnd.etsi.iptvdiscovery+xml"
  ]
}
