{
  "id": "http-header/references",
  "family": "http-header",
  "slug": "references",
  "title": "References",
  "summary": "Message header field \"References\" (protocol: mail), status standard.",
  "kind": "header",
  "status": "standard",
  "verification": "verified",
  "tier": "A",
  "source_url": "https://www.iana.org/assignments/message-headers/message-headers.xml",
  "source_version": "IANA registry, Last-Modified: Wed, 13 May 2026 22:01:20 GMT",
  "retrieved_date": "2026-05-29",
  "ext_type": "iana-registry-row@1",
  "ext": {
    "value": "References",
    "reference_rfcs": [],
    "raw_columns": {
      "value": "References",
      "protocol": "mail",
      "status": "standard",
      "Reference": ""
    }
  },
  "updated": "2026-05-29",
  "aliases": [
    "References"
  ]
}
