{
  "id": "port/369",
  "family": "port",
  "slug": "369",
  "title": "Port 369 — rpc2portmap",
  "summary": "Well-known port 369 (tcp/udp): rpc2portmap. Service name: rpc2portmap.",
  "kind": "port",
  "status": "standard",
  "verification": "verified",
  "tier": "A",
  "source_url": "https://www.iana.org/assignments/service-names-port-numbers/service-names-port-numbers.csv",
  "source_version": "IANA registry, Last-Modified: Fri, 29 May 2026 01:11:28 GMT",
  "retrieved_date": "2026-05-29",
  "ext_type": "iana-registry-row@1",
  "ext": {
    "value": 369,
    "reference_rfcs": [],
    "transports": [
      "tcp",
      "udp"
    ],
    "raw_columns": {
      "Service Name": "rpc2portmap",
      "Port Number": "369",
      "Transport Protocol": "tcp",
      "Description": "rpc2portmap",
      "Assignee": "",
      "Contact": "",
      "Registration Date": "",
      "Modification Date": "",
      "Reference": "",
      "Service Code": "",
      "Unauthorized Use Reported": "",
      "Assignment Notes": ""
    }
  },
  "updated": "2026-05-29"
}
