{
  "id": "link-relation/linkset",
  "family": "link-relation",
  "slug": "linkset",
  "title": "linkset",
  "summary": "Link relation type \"linkset\": The link target of a link with the \"linkset\" relation\n      type provides a set of links, including links in which the link\n      context of the link participa…. Defined in RFC9264.",
  "kind": "link-relation",
  "status": "standard",
  "verification": "verified",
  "tier": "A",
  "source_url": "https://www.iana.org/assignments/link-relations/link-relations-1.csv",
  "source_version": "IANA registry, Last-Modified: Mon, 12 Jan 2026 18:11:26 GMT",
  "retrieved_date": "2026-05-29",
  "ext_type": "iana-registry-row@1",
  "ext": {
    "value": "linkset",
    "reference_rfcs": [
      "RFC9264"
    ],
    "raw_columns": {
      "Relation Name": "linkset",
      "Description": "The link target of a link with the \"linkset\" relation\n      type provides a set of links, including links in which the link\n      context of the link participates.",
      "Reference": "[RFC9264]",
      "Notes": ""
    }
  },
  "updated": "2026-05-29"
}
