{
  "id": "http-method/MKCOL",
  "family": "http-method",
  "slug": "MKCOL",
  "title": "MKCOL",
  "summary": "HTTP request method MKCOL (safe: no, idempotent: yes). Defined in RFC4918, RFC5689, RFC8144.",
  "kind": "method",
  "status": "standard",
  "verification": "verified",
  "tier": "A",
  "source_url": "https://www.iana.org/assignments/http-methods/methods.csv",
  "source_version": "IANA registry, Last-Modified: Fri, 21 Nov 2025 20:46:23 GMT",
  "retrieved_date": "2026-05-29",
  "ext_type": "iana-registry-row@1",
  "ext": {
    "value": "MKCOL",
    "reference_rfcs": [
      "RFC4918",
      "RFC5689",
      "RFC8144"
    ],
    "raw_columns": {
      "Method Name": "MKCOL",
      "Safe": "no",
      "Idempotent": "yes",
      "Reference": "[RFC4918, Section 9.3][RFC5689, Section 3][RFC8144, Section 2.3]"
    }
  },
  "updated": "2026-05-29"
}
