{
  "id": "cbor-tag/32870",
  "family": "cbor-tag",
  "slug": "32870",
  "title": "CBOR tag 32870 — Logical operator: NONE / NOT. Encodes the logical operation…",
  "summary": "CBOR tag 32870 (data item: multiple): Logical operator: NONE / NOT. Encodes the logical operation (!item1&&!item2&&!item3&&..., if array), otherwise (!item)..",
  "kind": "tag",
  "status": "standard",
  "verification": "verified",
  "tier": "A",
  "source_url": "https://www.iana.org/assignments/cbor-tags/tags.csv",
  "source_version": "IANA registry, Last-Modified: Thu, 02 Apr 2026 23:51:20 GMT",
  "retrieved_date": "2026-05-29",
  "ext_type": "iana-registry-row@1",
  "ext": {
    "value": 32870,
    "reference_rfcs": [],
    "raw_columns": {
      "Tag": "32870",
      "Data Item": "multiple",
      "Semantics": "Logical operator: NONE / NOT. Encodes the logical operation (!item1&&!item2&&!item3&&..., if array), otherwise (!item).",
      "Reference": "[Jon_Caruana]",
      "Template": "template/32870"
    }
  },
  "updated": "2026-05-29"
}
