{
  "id": "media-type/application-im-iscomposing-xml",
  "family": "media-type",
  "slug": "application-im-iscomposing-xml",
  "title": "application/im-iscomposing+xml",
  "summary": "Media type \"application/im-iscomposing+xml\". Registered/referenced in RFC3994.",
  "kind": "media-type",
  "status": "standard",
  "verification": "verified",
  "tier": "A",
  "source_url": "https://www.iana.org/assignments/media-types/application.csv",
  "source_version": "IANA registry, Last-Modified: Wed, 20 May 2026 17:41:23 GMT",
  "retrieved_date": "2026-05-29",
  "ext_type": "iana-registry-row@1",
  "ext": {
    "value": "application/im-iscomposing+xml",
    "reference_rfcs": [
      "RFC3994"
    ],
    "raw_columns": {
      "Name": "im-iscomposing+xml",
      "Template": "application/im-iscomposing+xml",
      "Reference": "[RFC3994]"
    }
  },
  "updated": "2026-05-29",
  "aliases": [
    "application/im-iscomposing+xml"
  ]
}
