{
  "id": "media-type/video-bmpeg",
  "family": "media-type",
  "slug": "video-bmpeg",
  "title": "video/BMPEG",
  "summary": "Media type \"video/BMPEG\". Registered/referenced in RFC3555.",
  "kind": "media-type",
  "status": "standard",
  "verification": "verified",
  "tier": "A",
  "source_url": "https://www.iana.org/assignments/media-types/video.csv",
  "source_version": "IANA registry, Last-Modified: Tue, 23 Sep 2025 00:51:18 GMT",
  "retrieved_date": "2026-05-29",
  "ext_type": "iana-registry-row@1",
  "ext": {
    "value": "video/BMPEG",
    "reference_rfcs": [
      "RFC3555"
    ],
    "raw_columns": {
      "Name": "BMPEG",
      "Template": "video/BMPEG",
      "Reference": "[RFC3555]"
    }
  },
  "updated": "2026-05-29",
  "aliases": [
    "video/BMPEG"
  ]
}
